<?xml version="1.0" encoding="UTF-8"?>
<WeekDatesList xmlns:od="urn:schemas-microsoft-com:officedata" xmlns:xsi="http://www.w3.org/2001/XMLSchema-instance"  xsi:noNamespaceSchemaLocation="WeekDates.xsd" generated="2021-06-05T13:55:58">
<WeekDates>
<Week>1</Week>
<WeekDate>2009-05-06T00:00:00</WeekDate>
<EventType>23</EventType>
<Back9>1</Back9>
<Status>1</Status>
<Tees>Black</Tees>
<Back9Spcl>0</Back9Spcl>
<WeekBucket>0</WeekBucket>
<Shotgun>0</Shotgun>
<Rebuild>0</Rebuild>
<Dateplayed>2009-05-06T00:00:00</Dateplayed>
</WeekDates>
<WeekDates>
<Week>2</Week>
<WeekDate>2009-05-13T00:00:00</WeekDate>
<EventType>1</EventType>
<Back9>0</Back9>
<Status>1</Status>
<Tees>Blue</Tees>
<Back9Spcl>0</Back9Spcl>
<WeekBucket>1</WeekBucket>
<Shotgun>1</Shotgun>
<Rebuild>0</Rebuild>
<Dateplayed>2009-05-13T00:00:00</Dateplayed>
</WeekDates>
<WeekDates>
<Week>3</Week>
<WeekDate>2009-05-20T00:00:00</WeekDate>
<EventType>1</EventType>
<Back9>1</Back9>
<Status>1</Status>
<Tees>Black</Tees>
<Back9Spcl>0</Back9Spcl>
<WeekBucket>2</WeekBucket>
<Shotgun>1</Shotgun>
<Rebuild>0</Rebuild>
<Dateplayed>2009-05-20T00:00:00</Dateplayed>
</WeekDates>
<WeekDates>
<Week>4</Week>
<WeekDate>2009-05-27T00:00:00</WeekDate>
<EventType>1</EventType>
<Back9>0</Back9>
<Status>1</Status>
<Tees>Black</Tees>
<Back9Spcl>0</Back9Spcl>
<WeekBucket>3</WeekBucket>
<Shotgun>1</Shotgun>
<Rebuild>0</Rebuild>
<Dateplayed>2009-05-27T00:00:00</Dateplayed>
</WeekDates>
<WeekDates>
<Week>5</Week>
<WeekDate>2009-06-03T00:00:00</WeekDate>
<EventType>4</EventType>
<Back9>1</Back9>
<Status>1</Status>
<Tees>_</Tees>
<Back9Spcl>1</Back9Spcl>
<WeekBucket>0</WeekBucket>
<Shotgun>0</Shotgun>
<Rebuild>0</Rebuild>
<Dateplayed>2009-06-03T00:00:00</Dateplayed>
</WeekDates>
<WeekDates>
<Week>6</Week>
<WeekDate>2009-06-10T00:00:00</WeekDate>
<EventType>1</EventType>
<Back9>1</Back9>
<Status>1</Status>
<Tees>Blue</Tees>
<Back9Spcl>0</Back9Spcl>
<WeekBucket>4</WeekBucket>
<Shotgun>1</Shotgun>
<Rebuild>0</Rebuild>
<Dateplayed>2009-06-10T00:00:00</Dateplayed>
</WeekDates>
<WeekDates>
<Week>7</Week>
<WeekDate>2009-06-17T00:00:00</WeekDate>
<EventType>1</EventType>
<Back9>0</Back9>
<Status>1</Status>
<Tees>Black</Tees>
<Back9Spcl>0</Back9Spcl>
<WeekBucket>5</WeekBucket>
<Shotgun>1</Shotgun>
<Rebuild>0</Rebuild>
<Dateplayed>2009-06-17T00:00:00</Dateplayed>
</WeekDates>
<WeekDates>
<Week>8</Week>
<WeekDate>2009-06-24T00:00:00</WeekDate>
<EventType>1</EventType>
<Back9>1</Back9>
<Status>1</Status>
<Tees>Black</Tees>
<Back9Spcl>0</Back9Spcl>
<WeekBucket>6</WeekBucket>
<Shotgun>1</Shotgun>
<Rebuild>0</Rebuild>
<Dateplayed>2009-06-24T00:00:00</Dateplayed>
</WeekDates>
<WeekDates>
<Week>9</Week>
<WeekDate>2009-07-01T00:00:00</WeekDate>
<EventType>81</EventType>
<Back9>1</Back9>
<Status>1</Status>
<Tees>Blue</Tees>
<Back9Spcl>0</Back9Spcl>
<WeekBucket>0</WeekBucket>
<Shotgun>1</Shotgun>
<Rebuild>0</Rebuild>
<Dateplayed>2009-07-01T00:00:00</Dateplayed>
</WeekDates>
<WeekDates>
<Week>10</Week>
<WeekDate>2009-07-08T00:00:00</WeekDate>
<EventType>1</EventType>
<Back9>0</Back9>
<Status>1</Status>
<Tees>Blue</Tees>
<Back9Spcl>0</Back9Spcl>
<WeekBucket>7</WeekBucket>
<Shotgun>1</Shotgun>
<Rebuild>0</Rebuild>
<Dateplayed>2009-07-08T00:00:00</Dateplayed>
</WeekDates>
<WeekDates>
<Week>11</Week>
<WeekDate>2009-07-15T00:00:00</WeekDate>
<EventType>1</EventType>
<Back9>1</Back9>
<Status>1</Status>
<Tees>Black</Tees>
<Back9Spcl>0</Back9Spcl>
<WeekBucket>8</WeekBucket>
<Shotgun>1</Shotgun>
<Rebuild>0</Rebuild>
<Dateplayed>2009-07-15T00:00:00</Dateplayed>
</WeekDates>
<WeekDates>
<Week>12</Week>
<WeekDate>2009-07-22T00:00:00</WeekDate>
<EventType>1</EventType>
<Back9>0</Back9>
<Status>1</Status>
<Tees>Black</Tees>
<Back9Spcl>0</Back9Spcl>
<WeekBucket>9</WeekBucket>
<Shotgun>1</Shotgun>
<Rebuild>0</Rebuild>
<Dateplayed>2009-07-22T00:00:00</Dateplayed>
</WeekDates>
<WeekDates>
<Week>13</Week>
<WeekDate>2009-07-29T00:00:00</WeekDate>
<EventType>1</EventType>
<Back9>1</Back9>
<Status>1</Status>
<Tees>Blue</Tees>
<Back9Spcl>0</Back9Spcl>
<WeekBucket>10</WeekBucket>
<Shotgun>1</Shotgun>
<Rebuild>0</Rebuild>
<Dateplayed>2009-07-29T00:00:00</Dateplayed>
</WeekDates>
<WeekDates>
<Week>14</Week>
<WeekDate>2009-08-05T00:00:00</WeekDate>
<EventType>78</EventType>
<Back9>0</Back9>
<Status>1</Status>
<Tees>_</Tees>
<Back9Spcl>1</Back9Spcl>
<WeekBucket>0</WeekBucket>
<Shotgun>1</Shotgun>
<Rebuild>0</Rebuild>
<Dateplayed>2009-08-05T00:00:00</Dateplayed>
</WeekDates>
<WeekDates>
<Week>15</Week>
<WeekDate>2009-08-12T00:00:00</WeekDate>
<EventType>1</EventType>
<Back9>0</Back9>
<Status>0</Status>
<Tees>Black</Tees>
<Back9Spcl>0</Back9Spcl>
<WeekBucket>11</WeekBucket>
<Shotgun>1</Shotgun>
<Rebuild>0</Rebuild>
<Dateplayed>2009-08-12T00:00:00</Dateplayed>
</WeekDates>
<WeekDates>
<Week>16</Week>
<WeekDate>2009-08-19T00:00:00</WeekDate>
<EventType>27</EventType>
<Back9>1</Back9>
<Status>0</Status>
<Tees>Black</Tees>
<Back9Spcl>0</Back9Spcl>
<WeekBucket>0</WeekBucket>
<Shotgun>1</Shotgun>
<Rebuild>0</Rebuild>
<Dateplayed>2009-08-19T00:00:00</Dateplayed>
</WeekDates>
<WeekDates>
<Week>17</Week>
<WeekDate>2009-08-26T00:00:00</WeekDate>
<EventType>21</EventType>
<Back9>0</Back9>
<Status>0</Status>
<Tees>Black</Tees>
<Back9Spcl>0</Back9Spcl>
<WeekBucket>0</WeekBucket>
<Shotgun>0</Shotgun>
<Rebuild>0</Rebuild>
<Dateplayed>2009-08-26T00:00:00</Dateplayed>
</WeekDates>
<WeekDates>
<Week>18</Week>
<WeekDate>2009-09-02T00:00:00</WeekDate>
<EventType>21</EventType>
<Back9>1</Back9>
<Status>0</Status>
<Tees>Black</Tees>
<Back9Spcl>1</Back9Spcl>
<WeekBucket>0</WeekBucket>
<Shotgun>0</Shotgun>
<Rebuild>0</Rebuild>
<Dateplayed>2009-09-02T00:00:00</Dateplayed>
</WeekDates>
<WeekDates>
<Week>19</Week>
<WeekDate>2009-09-09T00:00:00</WeekDate>
<EventType>21</EventType>
<Back9>0</Back9>
<Status>0</Status>
<Tees>Black</Tees>
<Back9Spcl>0</Back9Spcl>
<WeekBucket>0</WeekBucket>
<Shotgun>0</Shotgun>
<Rebuild>0</Rebuild>
<Dateplayed>2009-09-09T00:00:00</Dateplayed>
</WeekDates>
<WeekDates>
<Week>20</Week>
<WeekDate>2009-09-16T00:00:00</WeekDate>
<EventType>21</EventType>
<Back9>1</Back9>
<Status>0</Status>
<Tees>Black</Tees>
<Back9Spcl>1</Back9Spcl>
<WeekBucket>0</WeekBucket>
<Shotgun>0</Shotgun>
<Rebuild>0</Rebuild>
<Dateplayed>2009-09-16T00:00:00</Dateplayed>
</WeekDates>
</WeekDatesList>
